<?xml version="1.0" encoding="UTF-8" standalone="no"?>
<!DOCTYPE file SYSTEM "final.dtd">
<file>
    <header idF="9">
        <nbMsg>1</nbMsg>
        <transmitter idUser="5">Groupe2</transmitter>
        <receiver idUser="1">Groupe1</receiver>
        <authRef>4766a8db-12c2-4321-bae0-dda86ea3f122</authRef>
        <authDate>2020-12-25 00:00:00.0</authDate>
    </header>
    <body>
        <listMsg>
            <message idMsg="10">
                <dateMsg>2020-12-25 00:00:00.0</dateMsg>
                <validityDuration>2020-12-25 00:00:00.0</validityDuration>
                <auth>
                    <authRef>2020-12-10 00:00:00.0</authRef>
                </auth>
            </message>
        </listMsg>
    </body>
</file>
